{
  "schema_version": "mimispec.provenance/0.1",
  "mms": {
    "path": "mimispec/mimispec/docs/corpora/mimi-markdown-real-project.mms",
    "revision_sha256": "c21d282db1e05d51a4ace674c4bdfda2d5b69b7a5e94ee255682c63ba57e9deb"
  },
  "source": {
    "language": "mimi",
    "path": "mimi/mimi/projects/mimi-markdown/main.mimi",
    "revision_sha256": "fe9dd4ad48d400e8f2317046c36134c9e326aed57e84aa26297b53f6e47aa160"
  },
  "links": [
    {
      "source_symbol": "main",
      "slot": {
        "scope_path": [],
        "node_kind": "desc",
        "anchor_kind": "keyword",
        "footprint": "entitykind",
        "owner_slot_ordinal": 0,
        "protected_sha256": "5d2b70db5377c80dac0ceaf6081e8b9f0d85cf783ee38261d49b90850a73b629"
      },
      "relation": "observed_from",
      "note": "The converter overview was transcribed from the MIMI project; known implementation defects remain open review intent."
    }
  ]
}
