{
  "schema_version": "mimispec.provenance/0.1",
  "mms": {
    "path": "mimispec/mimispec/docs/corpora/mimi-kv-real-project.mms",
    "revision_sha256": "afdd0b83bdc2dc8edba920d5b8b3baa83e7a0dbf62bff5ef232ee23c8e2aac4a"
  },
  "source": {
    "language": "mimi",
    "path": "mimi/mimi/projects/mimi-kv/src/main.mimi",
    "revision_sha256": "abcb457136a5772963a284f4651a1589f9080264d2403752f64e2275d96bbcfd"
  },
  "links": [
    {
      "source_symbol": "main",
      "slot": {
        "scope_path": [],
        "node_kind": "desc",
        "anchor_kind": "keyword",
        "footprint": "entitykind",
        "owner_slot_ordinal": 0,
        "protected_sha256": "f2eb4f935761d7583480e44970acba7d6bff656627d97c3cd56522e5fe12c88a"
      },
      "relation": "observed_from",
      "note": "The project-level service intent was transcribed from the MIMI entry point; this trace does not lock it."
    }
  ]
}
